{
  "manifest_version": "1.1.0",
  "format_version": "1.0",
  "package_name": "sentry_find_bugs_mellea",
  "entry_signature": "run_pipeline(diff: str, search_fn: Callable[[str], list[str]] = _default_search_fn, read_file_fn: Callable[[str, int, int], str] = _default_read_file_fn) -> FindingsReport",
  "generated_at": "2026-04-30T00:00:00Z",
  "melleafy_version": "4.3.2",
  "source_runtime": "agent_skills_std",
  "modality": "synchronous_oneshot",
  "archetype": "A",
  "categories_resolved": {
    "c1_identity": {
      "count": 0,
      "entries": []
    },
    "c2_operating_rules": {
      "count": 0,
      "entries": []
    },
    "c3_user_facts": {
      "count": 0,
      "entries": []
    },
    "c4_short_term_state": {
      "count": 0,
      "entries": []
    },
    "c5_long_term_memory": {
      "count": 0,
      "entries": []
    },
    "c6_tools": {
      "count": 3,
      "entries": [
        {
          "entry_id": "dep_002",
          "disposition": "real_impl",
          "target": "main.py:gather_diff"
        },
        {
          "entry_id": "dep_003",
          "disposition": "stub",
          "target": "constrained_slots.py:search_fn"
        },
        {
          "entry_id": "dep_004",
          "disposition": "stub",
          "target": "constrained_slots.py:read_file_fn"
        }
      ]
    },
    "c7_credentials": {
      "count": 0,
      "entries": []
    },
    "c8_runtime_environment": {
      "count": 1,
      "disposition": "bundle",
      "entries": [
        {
          "entry_id": "dep_001",
          "disposition": "bundle",
          "target": "config.py:SKILL_NAME"
        }
      ]
    },
    "c9_scheduling": {
      "count": 0,
      "entries": []
    }
  },
  "declared_env_vars": [],
  "pipeline_parameters": [
    {
      "name": "diff",
      "type": "str",
      "required": true
    },
    {
      "name": "search_fn",
      "type": "Callable[[str], list[str]]",
      "required": false
    },
    {
      "name": "read_file_fn",
      "type": "Callable[[str, int, int], str]",
      "required": false
    }
  ]
}
